{
  "id": "TCK-0001",
  "title": "Pure deterministic round lifecycle",
  "type": "feature-slice",
  "risk_tier": "low",
  "state": "PLAN_APPROVED",
  "spec_ref": "docs/features/first-playable/specification.md",
  "acceptance_ref": "docs/features/first-playable/acceptance-tests.md",
  "branch": "feature/tck-0001-round-lifecycle",
  "attempt_budget": 3,
  "attempts_used": 0,
  "authority_sensitive": true,
  "touches_persistence": false,
  "touches_economy": false,
  "created": "2026-07-20",
  "human_decisions_pending": []
}
