{
  "id": "TCK-0004",
  "title": "Server-owned objective qualification and immediate success",
  "type": "feature-slice",
  "risk_tier": "medium",
  "state": "CODE_REVIEW_PASS",
  "spec_ref": "docs/features/first-playable/specification.md",
  "acceptance_ref": "docs/features/first-playable/acceptance-tests.md",
  "branch": "feature/tck-0004-objective-success-observer",
  "attempt_budget": 2,
  "attempts_used": 1,
  "authority_sensitive": true,
  "touches_persistence": false,
  "touches_economy": false,
  "created": "2026-07-21",
  "human_decisions_pending": []
}
