{
  "id": "TCK-0006",
  "title": "Primitive client round feedback",
  "type": "feature-slice",
  "risk_tier": "medium",
  "state": "CODE_REVIEW_PASS",
  "spec_ref": "docs/features/first-playable/specification.md",
  "acceptance_ref": "docs/features/first-playable/acceptance-tests.md",
  "branch": "feature/tck-0006-primitive-client-feedback",
  "attempt_budget": 2,
  "attempts_used": 3,
  "authority_sensitive": true,
  "touches_persistence": false,
  "touches_economy": false,
  "created": "2026-07-30",
  "human_decisions_pending": []
}
